{
  "artifact_types": [
    "Playwright candidate test artifact",
    "fixture and locator design",
    "existing-test execution evidence",
    "flake and bootstrap handoff"
  ],
  "capability_id": "capability:playwright-test-engineering",
  "execution": {
    "candidate_execution_state": "not-executed-phase-6",
    "external": "none",
    "host_actions": [
      "approved-local-commands"
    ],
    "model_tools": [
      "read"
    ],
    "mutation_scope": "artifact-output",
    "remote_write": false
  },
  "forbidden_actions": [
    "request, reveal, print, persist, hash, or transmit credential or secret values",
    "perform source, local-system, browser, provider, publication, or remote mutations outside the exact atomic scope and fresh authorization",
    "invent commands, exits, duration, artifacts, captures, provider receipts, benchmark results, approval, or completion evidence",
    "combine independent evidence or findings with remediation, risk acceptance, publication, deployment, or release",
    "claim Phase 9 evaluation, Phase 10 approval, or released status"
  ],
  "hard_gates": [
    "A local-exec Playwright candidate cannot modify project tests or config; project installation or source writes require a separate authorized workspace capability.",
    "Independent review, QA, audit, acquisition, analysis, and triage never imply remediation; setup or authentication never implies downstream action authority."
  ],
  "id": "playwright-test-engineering",
  "inputs": [
    "Browser behaviors, test environments, risks, data, and automation acceptance goals."
  ],
  "outputs": [
    "Playwright candidate test artifact",
    "fixture and locator design",
    "existing-test execution evidence",
    "flake and bootstrap handoff"
  ],
  "permission_identity": "local-exec",
  "policy": {
    "coverage": [
      "candidate-test-artifact",
      "role-locator",
      "web-first-assertion",
      "isolated-fixture",
      "deterministic-wait",
      "no-project-write"
    ],
    "data_governance": false,
    "external_or_system_action": false,
    "human_decision": false,
    "review_source_separation": true
  },
  "responsibility": "Design Playwright test source as a candidate artifact and execute or diagnose authorized existing Playwright tests without writing project source.",
  "schema_version": "2.0",
  "status": "evaluating",
  "statuses": [
    "passed",
    "needs-input",
    "blocked",
    "failed"
  ],
  "version": "0.1.0-v2-candidate"
}
