{
  "artifact_types": [
    "provider experiment run identity",
    "frozen parameter and version manifest",
    "raw result references and failure evidence",
    "cost, duration, cancellation, and cleanup record"
  ],
  "capability_id": "capability:llm-experiment-execution",
  "execution": {
    "candidate_execution_state": "not-executed-phase-6",
    "external": "write-with-per-action-authorization",
    "host_actions": [
      "approved-provider-write"
    ],
    "model_tools": [
      "read"
    ],
    "mutation_scope": "remote-provider-write",
    "remote_write": true
  },
  "forbidden_actions": [
    "request, reveal, print, persist, hash, or transmit credential or secret values",
    "perform source, local-system, browser, provider, publication, or remote mutations outside the exact atomic scope and fresh authorization",
    "invent commands, exits, duration, artifacts, captures, provider receipts, benchmark results, approval, or completion evidence",
    "combine independent evidence or findings with remediation, risk acceptance, publication, deployment, or release",
    "claim Phase 9 evaluation, Phase 10 approval, or released status"
  ],
  "hard_gates": [
    "Experiment execution requires one exact reviewed definition and per-action provider authorization; any prompt, model, dataset, evaluator, metric, budget, transfer, or target drift invalidates or blocks the run.",
    "Independent review, QA, audit, acquisition, analysis, and triage never imply remediation; setup or authentication never implies downstream action authority."
  ],
  "id": "llm-experiment-execution",
  "inputs": [
    "Frozen experiment definition, dataset version, evaluator versions, provider target, budget, and authorization."
  ],
  "outputs": [
    "provider experiment run identity",
    "frozen parameter and version manifest",
    "raw result references and failure evidence",
    "cost, duration, cancellation, and cleanup record"
  ],
  "permission_identity": "remote-write-authorized-only",
  "policy": {
    "coverage": [
      "reviewed-definition",
      "exact-provider-target",
      "frozen-versions",
      "per-action-authorization",
      "budget",
      "idempotency",
      "run-receipt",
      "no-post-submit-drift"
    ],
    "data_governance": true,
    "external_or_system_action": true,
    "human_decision": true,
    "review_source_separation": true
  },
  "responsibility": "Execute one reviewed frozen LLM experiment against exact dataset and evaluator versions under per-action provider-write, budget, and data-transfer authorization.",
  "schema_version": "2.0",
  "status": "evaluating",
  "statuses": [
    "passed",
    "needs-input",
    "blocked",
    "failed"
  ],
  "version": "0.1.0-v2-candidate"
}
